query;title;url;abstract;authors;date;if;score;journal
"""Sickle cell"" AND ""CRISPR""";Ribonucleotide reductase inhibitors suppress SAMHD1 ara-CTPase activity enhancing cytarabine efficacy.;https://ncbi.nlm.nih.gov/pubmed/31950591;The deoxycytidine analogue cytarabine (ara-C) remains the backbone treatment of acute myeloid leukaemia (AML) as well as other haematological and lymphoid malignancies, but must be combined with other chemotherapeutics to achieve cure.  Yet, the underlying mechanism dictating synergistic efficacy of ....;Sean G Rudd ...  Nikolas Herold;2020-01-17;10.28;0.14;EMBO Mol Med
"""Triple negative breast cancer"" AND ""therapy""";The design and development of covalent protein-protein interaction inhibitors for cancer treatment.;https://ncbi.nlm.nih.gov/pubmed/32228680;Protein-protein interactions (PPIs) are central to a variety of biological processes, and their dysfunction is implicated in the pathogenesis of a range of human diseases, including cancer.  Hence, the inhibition of PPIs has attracted significant attention in drug discovery.;Sha-Sha Cheng ...  Dik-Lung Ma;2020-04-01;8.71;0.29;J Hematol Oncol
"""Triple negative breast cancer"" AND ""therapy""";NPM1 upregulates the transcription of PD-L1 and suppresses T cell activity in triple-negative breast cancer.;https://ncbi.nlm.nih.gov/pubmed/32245950;Programmed cell death protein-1 (PD-1)/programmed cell death ligand-1 (PD-L1) interaction plays a crucial role in tumor-associated immune escape.  Here, we verify that triple-negative breast cancer (TNBC) has higher PD-L1 expression than other subtypes.;Ge Qin ...  Wuguo Deng;2020-04-04;11.80;0.29;Nat Commun
"""Triple negative breast cancer"" AND ""therapy""";Autophagy-associated circRNA circCDYL augments autophagy and promotes breast cancer progression.;https://ncbi.nlm.nih.gov/pubmed/32213200;BACKGROUND: Although both circular RNAs (circRNAs) and autophagy are associated with the function of breast cancer (BC), whether circRNAs regulate BC progression via autophagy remains unknown.  In this study, we aim to explore the regulatory mechanisms and the clinical significance of autophagy-asso ....;Gehao Liang ...  Chang Gong;2020-03-27;11.35;0.29;Mol. Cancer
"""Triple negative breast cancer"" AND ""therapy""";HNF4A-AS1/hnRNPU/CTCF axis as a therapeutic target for aerobic glycolysis and neuroblastoma progression.;https://ncbi.nlm.nih.gov/pubmed/32216806;BACKGROUND: Aerobic glycolysis is a hallmark of metabolic reprogramming that contributes to tumor progression.  However, the mechanisms regulating expression of glycolytic genes in neuroblastoma (NB), the most common extracranial solid tumor in childhood, still remain elusive.;Huajie Song ...  Qiangsong Tong;2020-03-28;8.71;0.14;J Hematol Oncol
"""Triple negative breast cancer"" AND ""therapy""";The biological implications of Yin Yang 1 in the hallmarks of cancer.;https://ncbi.nlm.nih.gov/pubmed/32226547;Tumorigenesis is a multistep process characterized by the acquisition of genetic and epigenetic alterations.  During the course of malignancy development, tumor cells acquire several features that allow them to survive and adapt to the stress-related conditions of the tumor microenvironment.;Ian Timothy Sembiring Meliala ...  Shourong Wu;2020-03-31;8.02;0.14;Theranostics
"""Triple negative breast cancer"" AND ""therapy""";Aptamer-guided extracellular vesicle theranostics in oncology.;https://ncbi.nlm.nih.gov/pubmed/32226524;In the past decade, the study of exosomes, nanosized vesicles (50-150 nm) released into the extracellular space via the fusion of multivesicular bodies with the plasma membrane, has burgeoned with impressive achievements in theranostics applications.  These nanosized vesicles have emerged as key pla ....;Phuong H-L Tran ...  Wei Duan;2020-03-31;8.02;0.14;Theranostics
"""Triple negative breast cancer"" AND ""therapy""";Peptide-Based Vaccines: Current Progress and Future Challenges.;https://ncbi.nlm.nih.gov/pubmed/31804810;Vaccines have had a profound impact on the management and prevention of infectious disease.  In addition, the development of vaccines against chronic diseases has attracted considerable interest as an approach to prevent, rather than treat, conditions such as cancer, Alzheimer's disease, and others.;Ryan J Malonis ...  Olivia Vergnolle;2019-12-05;52.85;0.14;Chem. Rev.
"""Triple negative breast cancer"" AND ""therapy""";Meta-Analysis of Nanoparticle Delivery to Tumors Using a Physiologically Based Pharmacokinetic Modeling and Simulation Approach.;https://ncbi.nlm.nih.gov/pubmed/32078303;Numerous studies have engineered nanoparticles with different physicochemical properties to enhance the delivery efficiency to solid tumors, yet the mean and median delivery efficiencies are only 1. 48% and 0.;Yi-Hsien Cheng ...  Zhoumeng Lin;2020-02-22;13.70;0.14;ACS Nano
"""Triple negative breast cancer"" AND ""therapy""";Mapping the breast cancer metastatic cascade onto ctDNA using genetic and epigenetic clonal tracking.;https://ncbi.nlm.nih.gov/pubmed/32221288;Circulating tumour DNA (ctDNA) allows tracking of the evolution of human cancers at high resolution, overcoming many limitations of tissue biopsies.  However, exploiting ctDNA to determine how a patient's cancer is evolving in order to aid clinical decisions remains difficult.;George D Cresswell ...  Andrea Sottoriva;2020-03-29;11.80;0.14;Nat Commun
"""Triple negative breast cancer"" AND ""therapy""";HDAC8 cooperates with SMAD3/4 complex to suppress SIRT7 and promote cell survival and migration.;https://ncbi.nlm.nih.gov/pubmed/31970414;NAD+-dependent SIRT7 deacylase plays essential roles in ribosome biogenesis, stress response, genome integrity, metabolism and aging, while how it is transcriptionally regulated is still largely unclear.  TGF-β signaling is highly conserved in multicellular organisms, regulating cell growth, cancer  ....;Xiaolong Tang ...  Baohua Liu;2020-01-23;11.14;0.14;Nucleic Acids Res.
"""Checkpoint inhibitor"" and ""resistance""";Treating non-responders: pitfalls and implications for cancer immunotherapy trial design.;https://ncbi.nlm.nih.gov/pubmed/32171307;BACKGROUND: Conventional trial design and analysis strategies fail to address the typical challenge of immune-oncology (IO) studies: only a limited percentage of treated patients respond to the experimental treatment.  Treating non-responders, we hypothesize, would in part drive non-proportional haz ....;Zhenzhen Xu ...  Bin Zhu;2020-03-16;8.71;0.14;J Hematol Oncol
"""Checkpoint inhibitor"" and ""resistance""";Simultaneous inhibition of CXCR1/2, TGF-β, and PD-L1 remodels the tumor and its microenvironment to drive antitumor immunity.;https://ncbi.nlm.nih.gov/pubmed/32188703;BACKGROUND: Despite the success of immune checkpoint blockade therapy in the treatment of certain cancer types, only a small percentage of patients with solid malignancies achieve a durable response.  Consequently, there is a need to develop novel approaches that could overcome mechanisms of tumor r ....;Lucas A Horn ...  Claudia Palena;2020-03-19;8.66;0.14;J Immunother Cancer
"""Checkpoint inhibitor"" and ""resistance""";On the mechanism of anti-CD39 immune checkpoint therapy.;https://ncbi.nlm.nih.gov/pubmed/32098829;With the coming of age of cancer immunotherapy, the search for new therapeutic targets has led to the identification of immunosuppressive adenosine as an important regulator of antitumor immunity.  This resulted in the development of selective inhibitors targeting various components of the adenosine ....;David Allard ...  John Stagg;2020-02-26;8.66;0.14;J Immunother Cancer
"""Checkpoint inhibitor"" and ""resistance""";Molecular and immunological features of a prolonged exceptional responder with malignant pleural mesothelioma treated initially and rechallenged with pembrolizumab.;https://ncbi.nlm.nih.gov/pubmed/32169873;"BACKGROUND: This case represents an exceptional response to pembrolizumab in a patient with epithelioid mesothelioma with a further response on rechallenge. 
CASE PRESENTATION: A 77-year-old woman with advanced epithelioid mesothelioma extensively pretreated with chemotherapy demonstrated a prolonge ....";Anna Minchom ...  Juanita Lopez;2020-03-14;8.66;0.14;J Immunother Cancer
"""Checkpoint inhibitor"" and ""resistance""";Oncolytic vaccinia virus delivering tethered IL-12 enhances antitumor effects with improved safety.;https://ncbi.nlm.nih.gov/pubmed/32209602;"Immune checkpoint blockade is arguably the most effective current cancer therapy approach; however, its efficacy is limited to patients with ""hot"" tumors, warranting an effective approach to transform ""cold"" tumors.  Oncolytic viruses (especially properly armed ones) have positive effects on almost  ....";Yan Ge ...  David L Bartlett;2020-03-26;8.66;0.14;J Immunother Cancer
"""Checkpoint inhibitor"" and ""resistance""";Consensus guidelines for the definition, detection and interpretation of immunogenic cell death.;https://ncbi.nlm.nih.gov/pubmed/32209603;Cells succumbing to stress via regulated cell death (RCD) can initiate an adaptive immune response associated with immunological memory, provided they display sufficient antigenicity and adjuvanticity.  Moreover, multiple intracellular and microenvironmental features determine the propensity of RCD  ....;Lorenzo Galluzzi ...  Francesco M Marincola;2020-03-26;8.66;0.14;J Immunother Cancer
"""Checkpoint inhibitor"" and ""resistance""";Sixth Immunotherapy of Cancer conference (ITOC): advances and perspectives-a meeting report.;https://ncbi.nlm.nih.gov/pubmed/32114499;Immunotherapy has moved to the forefront of cancer treatment, illustrated by the accelerating pace of novel therapy approvals.  In this complex environment, scientists rely on cutting edge conferences to stay informed.;Catarina Pinto ...  Sebastian Kobold;2020-03-02;8.66;0.14;J Immunother Cancer
"""Checkpoint inhibitor"" and ""resistance""";Peptide-Based Vaccines: Current Progress and Future Challenges.;https://ncbi.nlm.nih.gov/pubmed/31804810;Vaccines have had a profound impact on the management and prevention of infectious disease.  In addition, the development of vaccines against chronic diseases has attracted considerable interest as an approach to prevent, rather than treat, conditions such as cancer, Alzheimer's disease, and others.;Ryan J Malonis ...  Olivia Vergnolle;2019-12-05;52.85;0.14;Chem. Rev.
"""Checkpoint inhibitor"" and ""resistance""";Annexin A5 as an immune checkpoint inhibitor and tumor-homing molecule for cancer treatment.;https://ncbi.nlm.nih.gov/pubmed/32111835;The interaction between immune cells and phosphatidylserine (PS) molecules exposed on the surface of apoptotic-tumor bodies, such as those induced by chemotherapies, contributes to the formation of an immunosuppressive tumor microenvironment (TME).  Annexin A5 (AnxA5) binds with high affinity to PS  ....;Tae Heung Kang ...  Chien-Fu Hung;2020-02-29;11.80;0.14;Nat Commun
"""Checkpoint inhibitor"" and ""resistance""";Cancer immune control needs senescence induction by interferon-dependent cell cycle regulator pathways in tumours.;https://ncbi.nlm.nih.gov/pubmed/32165639;Immune checkpoint blockade (ICB)-based or natural cancer immune responses largely eliminate tumours.  Yet, they require additional mechanisms to arrest those cancer cells that are not rejected.;Ellen Brenner ...  Martin Röcken;2020-03-13;11.80;0.14;Nat Commun
"""Checkpoint inhibitor"" and ""resistance""";Burden of tumor mutations, neoepitopes, and other variants are weak predictors of cancer immunotherapy response and overall survival.;https://ncbi.nlm.nih.gov/pubmed/32228719;"BACKGROUND: Tumor mutational burden (TMB; the quantity of aberrant nucleotide sequences a given tumor may harbor) has been associated with response to immune checkpoint inhibitor therapy and is gaining broad acceptance as a result.  However, TMB harbors intrinsic variability across cancer types, and ....";Mary A Wood ...  Reid F Thompson;2020-04-01;10.47;0.14;Genome Med
"""Checkpoint inhibitor"" and ""resistance""";Integrative -omics and HLA-ligandomics analysis to identify novel drug targets for ccRCC immunotherapy.;https://ncbi.nlm.nih.gov/pubmed/32228647;BACKGROUND: Clear cell renal cell carcinoma (ccRCC) is the dominant subtype of renal cancer.  With currently available therapies, cure of advanced and metastatic ccRCC is achieved only in rare cases.;Anna Reustle ...  Elke Schaeffeler;2020-04-01;10.47;0.14;Genome Med
"""Checkpoint inhibitor"" and ""resistance""";Predictable modulation of cancer treatment outcomes by the gut microbiota.;https://ncbi.nlm.nih.gov/pubmed/32138779;The gut microbiota has the potential to influence the efficacy of cancer therapy.  Here, we investigated the contribution of the intestinal microbiome on treatment outcomes in a heterogeneous cohort that included multiple cancer types to identify microbes with a global impact on immune response.;Yoshitaro Heshiki ...  Gianni Panagiotou;2020-03-06;10.35;0.14;Microbiome
"""Covid-19"" OR ""SARS-CoV-2""";Extracellular superoxide dismutase, a molecular transducer of health benefits of exercise.;https://ncbi.nlm.nih.gov/pubmed/32220789;Extracellular superoxide dismutase (EcSOD) is the only extracellular scavenger of superoxide anion (O;Zhen Yan ...  Hannah R Spaulding;2020-03-29;7.77;0.14;Redox Biol
"""Exosome""";The mechanisms and treatments for sarcopenia: could exosomes be a perspective research strategy in the future?;https://ncbi.nlm.nih.gov/pubmed/31989804;The age-related loss of muscle mass and muscle function known as sarcopenia is a primary contributor to the problems faced by the old people.  Sarcopenia has been a major public health problem with high prevalence in many countries.;Shuang Rong ...  Wei Yang;2020-01-28;9.55;1.0;J Cachexia Sarcopenia Muscle
"""Exosome""";Progress, opportunity, and perspective on exosome isolation - efforts for efficient exosome-based theranostics.;https://ncbi.nlm.nih.gov/pubmed/32206116;Exosomes are small extracellular vesicles with diameters of 30-150 nm.  In both physiological and pathological conditions, nearly all types of cells can release exosomes, which play important roles in cell communication and epigenetic regulation by transporting crucial protein and genetic materials  ....;Dongbin Yang ...  Tao Wang;2020-03-24;8.02;1.0;Theranostics
"""Exosome""";Aptamer-guided extracellular vesicle theranostics in oncology.;https://ncbi.nlm.nih.gov/pubmed/32226524;In the past decade, the study of exosomes, nanosized vesicles (50-150 nm) released into the extracellular space via the fusion of multivesicular bodies with the plasma membrane, has burgeoned with impressive achievements in theranostics applications.  These nanosized vesicles have emerged as key pla ....;Phuong H-L Tran ...  Wei Duan;2020-03-31;8.02;0.43;Theranostics
"""Exosome""";Exosomal noncoding RNAs in Glioma: biological functions and potential clinical applications.;https://ncbi.nlm.nih.gov/pubmed/32213181;Gliomas are complex and heterogeneous brain tumors with poor prognosis.  Glioma cells can communicate with their surroundings to create a tumor-permissive microenvironment.;Jian Cheng ...  Yong Peng;2020-03-27;11.35;0.43;Mol. Cancer
"""Exosome""";Dying tumor cell-derived exosomal miR-194-5p potentiates survival and repopulation of tumor repopulating cells upon radiotherapy in pancreatic cancer.;https://ncbi.nlm.nih.gov/pubmed/32228703;BACKGROUND: Tumor repopulation is a major cause of radiotherapy failure.  Previous investigations highlighted that dying tumor cells played vital roles in tumor repopulation through promoting proliferation of the residual tumor repopulating cells (TRCs).;Ming-Jie Jiang ...  Ling Tian;2020-04-01;11.35;0.43;Mol. Cancer
"""Exosome""";Termination of non-coding transcription in yeast relies on both an RNA Pol II CTD interaction domain and a CTD-mimicking region in Sen1.;https://ncbi.nlm.nih.gov/pubmed/32107786;Pervasive transcription is a widespread phenomenon leading to the production of a plethora of non-coding RNAs (ncRNAs) without apparent function.  Pervasive transcription poses a threat to proper gene expression that needs to be controlled.;Zhong Han ...  Odil Porrua;2020-02-28;9.96;0.14;EMBO J.
"""Exosome""";HNF4A-AS1/hnRNPU/CTCF axis as a therapeutic target for aerobic glycolysis and neuroblastoma progression.;https://ncbi.nlm.nih.gov/pubmed/32216806;BACKGROUND: Aerobic glycolysis is a hallmark of metabolic reprogramming that contributes to tumor progression.  However, the mechanisms regulating expression of glycolytic genes in neuroblastoma (NB), the most common extracranial solid tumor in childhood, still remain elusive.;Huajie Song ...  Qiangsong Tong;2020-03-28;8.71;0.14;J Hematol Oncol
"""Exosome""";Circular RNA-protein interactions: functions, mechanisms, and identification.;https://ncbi.nlm.nih.gov/pubmed/32206104;Circular RNAs (circRNAs) are covalently closed, endogenous RNAs with no 5' end caps or 3' poly(A) tails.  These RNAs are expressed in tissue-specific, cell-specific, and developmental stage-specific patterns.;Anqing Huang ...  Yuli Huang;2020-03-24;8.02;0.14;Theranostics
"""Exosome""";Neuronal activity triggers uptake of hematopoietic extracellular vesicles in vivo.;https://ncbi.nlm.nih.gov/pubmed/32176686;Communication with the hematopoietic system is a vital component of regulating brain function in health and disease.  Traditionally, the major routes considered for this neuroimmune communication are by individual molecules such as cytokines carried by blood, by neural transmission, or, in more seve ....;Ivan-Maximiliano Kur ...  Stefan Momma;2020-03-16;7.62;0.14;PLoS Biol.
"""Exosome""";Regulation of long non-coding RNAs and genome dynamics by the RNA surveillance machinery.;https://ncbi.nlm.nih.gov/pubmed/32020081;Much of the mammalian genome is transcribed, generating long non-coding RNAs (lncRNAs) that can undergo post-transcriptional surveillance whereby only a subset of the non-coding transcripts is allowed to attain sufficient stability to persist in the cellular milieu and control various cellular funct ....;Lekha Nair ...  Uttiya Basu;2020-02-05;38.42;0.14;Nat. Rev. Mol. Cell Biol.
"""Exosome""";Lipidomics and RNA sequencing reveal a novel subpopulation of nanovesicle within extracellular matrix biomaterials.;https://ncbi.nlm.nih.gov/pubmed/32219161;Biomaterials composed of extracellular matrix (ECM) provide both mechanical support and a reservoir of constructive signaling molecules that promote functional tissue repair.  Recently, matrix-bound nanovesicles (MBVs) have been reported as an integral component of ECM bioscaffolds.;George S Hussey ...  Stephen F Badylak;2020-03-28;12.53;0.14;Sci Adv
"""Exosome""";The translational landscape of ground state pluripotency.;https://ncbi.nlm.nih.gov/pubmed/32238817;Translational control plays a central role in regulation of gene expression and can lead to significant divergence between mRNA- and protein-abundance.  Here, we used genome-wide approaches combined with time-course analysis to measure the mRNA-abundance, mRNA-translation rate and protein expression ....;Yaser Atlasi ...  Hendrik G Stunnenberg;2020-04-02;11.80;0.14;Nat Commun
"""Exosome""";Structural insights into tetraspanin CD9 function.;https://ncbi.nlm.nih.gov/pubmed/32231207;Tetraspanins play critical roles in various physiological processes, ranging from cell adhesion to virus infection.  The members of the tetraspanin family have four membrane-spanning domains and short and large extracellular loops, and associate with a broad range of other functional proteins to exe ....;Rie Umeda ...  Osamu Nureki;2020-04-01;11.80;0.14;Nat Commun
"""Exosome""";Advances in therapeutic applications of extracellular vesicles.;https://ncbi.nlm.nih.gov/pubmed/31092696;Extracellular vesicles (EVs) are nanometer-sized, lipid membrane-enclosed vesicles secreted by most, if not all, cells and contain lipids, proteins, and various nucleic acid species of the source cell.  EVs act as important mediators of intercellular communication that influence both physiological a ....;Oscar P B Wiklander ...  Samir El Andaloussi;2019-05-16;11.64;0.14;Sci Transl Med
"""Exosome""";Counter-regulatory renin-angiotensin system in cardiovascular disease.;https://ncbi.nlm.nih.gov/pubmed/31427727;The renin-angiotensin system is an important component of the cardiovascular system.  Mounting evidence suggests that the metabolic products of angiotensin I and II - initially thought to be biologically inactive - have key roles in cardiovascular physiology and pathophysiology.;Maria Paz Ocaranza ...  Sergio Lavandero;2019-08-20;11.51;0.14;Nat Rev Cardiol
"""Exosome""";A crucial RNA-binding lysine residue in the Nab3 RRM domain undergoes SET1 and SET3-responsive methylation.;https://ncbi.nlm.nih.gov/pubmed/31960028;The Nrd1-Nab3-Sen1 (NNS) complex integrates molecular cues to direct termination of noncoding transcription in budding yeast.  NNS is positively regulated by histone methylation as well as through Nrd1 binding to the initiating form of RNA PolII.;Kwan Yin Lee ...  Marc D Meneghini;2020-01-21;11.14;0.14;Nucleic Acids Res.
"""Exosome""";Integrative -omics and HLA-ligandomics analysis to identify novel drug targets for ccRCC immunotherapy.;https://ncbi.nlm.nih.gov/pubmed/32228647;BACKGROUND: Clear cell renal cell carcinoma (ccRCC) is the dominant subtype of renal cancer.  With currently available therapies, cure of advanced and metastatic ccRCC is achieved only in rare cases.;Anna Reustle ...  Elke Schaeffeler;2020-04-01;10.47;0.14;Genome Med
"""Nanoparticle delivery"" OR ""non-viral delivery""";Meta-Analysis of Nanoparticle Delivery to Tumors Using a Physiologically Based Pharmacokinetic Modeling and Simulation Approach.;https://ncbi.nlm.nih.gov/pubmed/32078303;Numerous studies have engineered nanoparticles with different physicochemical properties to enhance the delivery efficiency to solid tumors, yet the mean and median delivery efficiencies are only 1. 48% and 0.;Yi-Hsien Cheng ...  Zhoumeng Lin;2020-02-22;13.70;0.43;ACS Nano
"""Nanoparticle delivery"" OR ""non-viral delivery""";In situ genetic engineering of tumors for long-lasting and systemic immunotherapy.;https://ncbi.nlm.nih.gov/pubmed/32034097;Cancer immunotherapy has been the subject of extensive research, but highly effective and broadly applicable methods remain elusive.  Moreover, a general approach to engender endogenous patient-specific cellular therapy, without the need for a priori knowledge of tumor antigen, ex vivo cellular mani ....;Stephany Y Tzeng ...  Jordan J Green;2020-02-08;9.35;0.14;Proc. Natl. Acad. Sci. U.S.A.
"""Nanoparticle delivery"" OR ""non-viral delivery""";Tuned near infrared fluorescent hyaluronic acid conjugates for delivery to pancreatic cancer for intraoperative imaging.;https://ncbi.nlm.nih.gov/pubmed/32206099;The prognosis of pancreatic cancer remains poor.  Intraoperative fluorescence imaging of tumors could improve staging and surgical resection, thereby improving prognosis.;Bowen Qi ...  Aaron M Mohs;2020-03-24;8.02;0.14;Theranostics
"""Nanoparticle delivery"" OR ""non-viral delivery""";Using magnetic particle imaging systems to localize and guide magnetic hyperthermia treatment: tracers, hardware, and future medical applications.;https://ncbi.nlm.nih.gov/pubmed/32194849;Magnetic fluid hyperthermia (MFH) treatment makes use of a suspension of superparamagnetic iron oxide nanoparticles, administered systemically or locally, in combination with an externally applied alternating magnetic field, to ablate target tissue by generating heat through a process called inducti ....;Prashant Chandrasekharan ...  Steven Conolly;2020-03-20;8.02;0.14;Theranostics
"""Nanoparticle delivery"" OR ""non-viral delivery""";RNA-based scaffolds for bone regeneration: application and mechanisms of mRNA, miRNA and siRNA.;https://ncbi.nlm.nih.gov/pubmed/32194862;Globally, more than 1. 5 million patients undergo bone graft surgeries annually, and the development of biomaterial scaffolds that mimic natural bone for bone grafting remains a tremendous challenge.;Qiuping Leng ...  Yonggang Lv;2020-03-20;8.02;0.14;Theranostics
"""Nanoparticle delivery"" OR ""non-viral delivery""";Modulation of tumor microenvironment for immunotherapy: focus on nanomaterial-based strategies.;https://ncbi.nlm.nih.gov/pubmed/32194857;Recent advances in the field of immunotherapy have profoundly opened up the potential for improved cancer therapy and reduced side effects.  However, the tumor microenvironment (TME) is highly immunosuppressive, therefore, clinical outcomes of currently available cancer immunotherapy are still poor.;Yun Liu ...  Leaf Huang;2020-03-20;8.02;0.14;Theranostics
"""Nanoparticle delivery"" OR ""non-viral delivery""";EDTA-Modified 17β-Estradiol-Laden Upconversion Nanocomposite for Bone-Targeted Hormone Replacement Therapy for Osteoporosis.;https://ncbi.nlm.nih.gov/pubmed/32194868;Hormone therapy (HT) is one of the most effective treatments for osteoporosis.  However, the nonselective accumulation of hormone in organs such as breast, heart and uterus other than bones causes serious side effects, which impedes the application of HT.;Xiaoting Chen ...  Yanhong Gao;2020-03-20;8.02;0.14;Theranostics
"""Nanoparticle delivery"" OR ""non-viral delivery""";Detection of Marker-Free Precision Genome Editing and Genetic Variation through the Capture of Genomic Signatures.;https://ncbi.nlm.nih.gov/pubmed/32160537;Genome editing technologies have transformed our ability to engineer desired genomic changes within living systems.  However, detecting precise genomic modifications often requires sophisticated, expensive, and time-consuming experimental approaches.;Pierre Billon ...  Alberto Ciccia;2020-03-11;7.70;0.14;Cell Rep
